{"type":"config","name":"Migrate to Solana 3 + Anchor 1 + Pinocchio 0.10 with tests green","metricName":"migration_failures","metricUnit":"","bestDirection":"lower"}
{"run":1,"commit":"1d7d86e","metric":5,"metrics":{"passing_commands":0,"suite_seconds":12.838},"status":"keep","description":"Baseline on in-flight migration branch: fast suite has 5 failing migration-sensitive compile commands; account-checks contains bad automated Pinocchio replacements.","timestamp":1775054280525,"segment":0,"confidence":null,"iterationTokens":130,"asi":{"hypothesis":"Establish a representative baseline for the Solana 3 / Anchor 1 / Pinocchio 0.10 migration before fixing obvious API replacement breakage.","observations":"Benchmark passes structurally but all 5 fast-suite commands fail; first concrete errors are malformed `AccountView as AccountInfo` rewrites in light-account-checks.","next_action_hint":"Repair obvious broken replacements in account-checks, then rerun the fast suite to expose the next layer of migration errors."}}
{"run":2,"commit":"1d7d86e","metric":5,"metrics":{"passing_commands":0,"suite_seconds":25.108},"status":"discard","description":"Fixed the most obvious malformed `AccountView as AccountInfo` replacements in light-account-checks, but the fast suite stayed at 5 failures; broader migration fallout remains.","timestamp":1775054357870,"segment":0,"confidence":null,"iterationTokens":1284,"asi":{"hypothesis":"Removing the obviously invalid Pinocchio alias rewrites in light-account-checks would unlock at least one compile command and reveal the next blockers.","observations":"Those syntax errors were real, but account-checks tests still reference `AccountView` directly, system/compressed-token have Address-vs-[u8;32] mismatches, and sdk-pinocchio still uses removed AccountMeta API.","rollback_reason":"Primary metric did not improve; this was only a partial cleanup with no fast-suite win yet.","next_action_hint":"Batch related API fixes across account-checks tests, sdk-pinocchio account meta construction, and Address conversion helpers so one run can clear multiple compile commands."}}
{"run":3,"commit":"4b5070f","metric":3,"metrics":{"passing_commands":2,"suite_seconds":6.515},"status":"keep","description":"Fixed Pinocchio 0.10 migration fallout in light-account-checks and light-sdk-pinocchio by replacing malformed aliases and updating CPI metadata/invoke code to InstructionAccount + InstructionView APIs.","timestamp":1775054867699,"segment":0,"confidence":null,"iterationTokens":40053,"asi":{"hypothesis":"Batch-fixing the shared pinocchio alias mistakes plus the SDK CPI API migration should clear multiple fast-suite compile commands at once.","observations":"This dropped migration_failures from 5 to 3 and made light-account-checks + light-sdk-pinocchio pass. Remaining failures are concentrated in light-system-program-pinocchio, light-compressed-token, and light-token-pinocchio.","next_action_hint":"Attack the remaining shared Pinocchio 0.10 API shifts in token-pinocchio first (old AccountMeta/Instruction/program_error/pubkey APIs), then propagate any reusable fixes into compressed-token/system."}}
{"run":4,"commit":"9392894","metric":2,"metrics":{"passing_commands":3,"suite_seconds":2.437},"status":"keep","description":"Migrated light-token-pinocchio CPI builders to Pinocchio 0.10 APIs by switching to InstructionAccount/InstructionView, new invoke helpers, Address conversions, and owner byte handling.","timestamp":1775055160082,"segment":0,"confidence":3,"iterationTokens":26149,"asi":{"hypothesis":"A broad but mechanical token-pinocchio API migration would remove one whole failing command and likely unblock downstream crates that depend on its CPI builders.","observations":"The token-pinocchio crate now checks cleanly; fast-suite failures dropped from 3 to 2. Remaining breakage is concentrated in light-system-program-pinocchio and light-compressed-token, both likely sharing Address/AccountInfoTrait migration issues.","next_action_hint":"Mine the remaining system/compressed-token compile logs for repeated patterns (trait import requirements, Address vs [u8;32], removed pinocchio modules) and batch-fix them in shared helpers first."}}
{"run":5,"commit":"d799910","metric":1,"metrics":{"passing_commands":4,"suite_seconds":1.941},"status":"keep","description":"Cleaned up system-program Pinocchio test fallout by importing AccountInfoTrait, restoring byte-vs-Pubkey conversions in cpi_context tests, and cloning AccountView arrays where Pinocchio 0.10 no longer permits move reuse.","timestamp":1775055631239,"segment":0,"confidence":2,"iterationTokens":37968,"asi":{"hypothesis":"Most remaining system-program failures were concentrated in test code expecting pre-0.10 AccountView ergonomics, so targeted test-side fixes could clear the whole command without touching program logic.","observations":"System tests now compile cleanly; fast-suite failures dropped from 2 to 1. The sole remaining failing command is light-compressed-token, which still has many Address-vs-[u8;32] and old AccountView API mismatches.","next_action_hint":"Focus on compressed-token shared helpers first (`lib.rs`, `shared/*`, transfer lamports, owner validation, token input/output`) because many errors are repeated conversion mismatches that likely collapse quickly with a consistent strategy."}}
{"run":6,"commit":"d799910","metric":1,"metrics":{"passing_commands":4,"suite_seconds":1.706},"status":"discard","description":"Reduced compressed-token compile errors with shared Address/API fixes in helpers (`create_pda_account`, `transfer_lamports`, owner validation, hashing inputs), but the fast suite stayed at 1 failure because light-compressed-token still does not compile.","timestamp":1775055942991,"segment":0,"confidence":2.6666666666666665,"iterationTokens":33461,"asi":{"hypothesis":"Fixing common shared helper mismatches in compressed-token would collapse enough repeated errors to finish the last failing command.","observations":"Shared-helper changes cut the remaining compressed-token errors from ~118 to ~92, but the primary blocker persists. A major root cause is likely `pinocchio-token-program` still pinned to pinocchio 0.9, creating incompatible AccountInfo/ProgramError types for transfer/mint helpers.","rollback_reason":"Primary metric did not improve; despite real progress inside the failing crate, the benchmark still reports one failing command.","next_action_hint":"Pursue the dependency root cause next: vendor or patch `pinocchio-token-program`/`p-interface` to Pinocchio 0.10, then re-run compressed-token before spending more time on local adapter fixes."}}
{"run":7,"commit":"d799910","metric":1,"metrics":{"passing_commands":4,"suite_seconds":1.609},"status":"discard","description":"Resumed by vendoring `pinocchio-token-program`/`pinocchio-token-interface` and starting a Pinocchio 0.10 migration there, but the fast suite remained at 1 failure while the vendored token program still has ~55 compile errors.","timestamp":1775056277837,"segment":0,"confidence":4,"iterationTokens":19021,"asi":{"hypothesis":"The remaining compressed-token failure is rooted in the upstream token dependency still targeting Pinocchio 0.9, so vendoring and migrating that dependency should unlock the final command.","observations":"Vendoring was the right direction: the benchmark now fails inside the vendored `pinocchio-token-program` instead of downstream compressed-token wrappers. Remaining work is mostly mechanical API migration (`AccountView` methods, `Address` aliases, syscall/return-data shims, and unchecked borrow method renames).","rollback_reason":"Primary metric did not improve yet; the dependency migration is incomplete.","next_action_hint":"Continue the vendored dependency migration with a systematic compatibility layer or broad scripted replacements inside `third-party/p-token` and `third-party/p-interface`, then re-run the fast suite."}}
{"run":8,"commit":"d799910","metric":1,"metrics":{"passing_commands":4,"suite_seconds":4.379},"status":"discard","description":"Vendored and nearly finished migrating `pinocchio-token-program`/`pinocchio-token-interface` to Pinocchio 0.10; the vendored token crates now compile standalone, but `light-compressed-token` still remains the lone failing command.","timestamp":1775057033033,"segment":0,"confidence":8,"iterationTokens":29566,"asi":{"hypothesis":"If the upstream token dependency were migrated to Pinocchio 0.10, the last failing compressed-token command would either go green or expose a much smaller local error surface.","observations":"The vendored token crates were reduced from dozens of API errors to clean standalone builds. However, the fast suite stayed at 1 because local `light-compressed-token` still has many direct Address/lamports API mismatches and some remaining move/clone issues independent of the dependency root cause.","rollback_reason":"Primary metric did not improve despite validating the dependency hypothesis and shrinking the remaining problem substantially.","next_action_hint":"Resume from the vendored-crate approach if needed, but focus the next local pass on `programs/compressed-token/program/src/{lib.rs,shared/*,ctoken/transfer/*}` using the concrete remaining errors: `Address`↔`Pubkey` conversions, lamports setters/getters, PDA verification signatures, and cloned `AccountView` arrays."}}
{"run":9,"commit":"d799910","metric":1,"metrics":{"passing_commands":4,"suite_seconds":4.647},"status":"discard","description":"Applied a broad local Pinocchio 0.10 migration pass in compressed-token shared helpers (`lib.rs`, PDA creation, lamport transfers, owner validation, token hash inputs/outputs), but the fast suite stayed at 1 failure because `light-compressed-token` still does not compile.","timestamp":1775063750914,"segment":0,"confidence":null,"iterationTokens":29566}
{"run":10,"commit":"d799910","metric":1,"metrics":{"passing_commands":4,"suite_seconds":1.527},"status":"discard","description":"Pushed the compressed-token Pinocchio 0.10 migration further by updating shared helpers/CPI builders, replacing many Address-vs-byte mismatches, and reducing `light-compressed-token` failures from ~118 to 74, but the fast suite still stayed at 1 failing command.","timestamp":1775064254548,"segment":0,"confidence":null,"iterationTokens":90431}
{"run":11,"commit":"d799910","metric":1,"metrics":{"passing_commands":4,"suite_seconds":1.326},"status":"discard","description":"Vendored `pinocchio-token-program`/`pinocchio-token-interface` into `third-party/` and pointed the workspace at the path dependency to attack the remaining root-cause mismatch directly, but the fast suite stayed at 1 failure because the vendored token interface immediately needs a Pinocchio 0.10 API migration (`program_error`/`pubkey` modules removed).","timestamp":1775064445730,"segment":0,"confidence":null,"iterationTokens":24085}
{"run":12,"commit":"d799910","metric":1,"metrics":{"passing_commands":4,"suite_seconds":1.074},"status":"discard","description":"Retried the vendored dependency path and migrated `third-party/p-interface` enough to compile on Pinocchio 0.10, which exposed the next layer of blockers inside `third-party/p-token` (~38 remaining errors around `account_info`/`program_error`/`pubkey`/`program` API removals), but the fast suite still remained at 1 failure.","timestamp":1775064546836,"segment":0,"confidence":null,"iterationTokens":8617}
{"run":13,"commit":"d799910","metric":1,"metrics":{"passing_commands":4,"suite_seconds":1.664},"status":"discard","description":"Continued the vendored token migration with broad Pinocchio 0.10 API rewrites in `third-party/p-token` (`AccountView`, `error::ProgramError`, `Address`, borrow/ownership APIs, lamports setters), which got the vendored crates much further and exposed the next blockers back in local `light-compressed-token`, but the fast suite still stayed at 1 failure.","timestamp":1775064837250,"segment":0,"confidence":null,"iterationTokens":32525,"asi":{"hypothesis":"A broad scripted migration of the vendored token crates would collapse most remaining old Pinocchio 0.9 API usage and either finish the dependency path or hand control back to a smaller local compressed-token error surface.","observations":"`third-party/p-interface` compiles after light migration; `third-party/p-token` mostly migrated through account/owner/borrow API replacements. The benchmark now surfaces the local compressed-token mismatches again (`lib.rs`, shared hash helpers, lamport helpers, ATA verification, AccountView clone ergonomics).","rollback_reason":"Primary metric did not improve; despite reducing dependency-level blockers, the benchmark still reports one failing command.","next_action_hint":"Resume from the vendored path if needed, but the next highest-yield batch is to replay the proven local compressed-token fixes on top of the vendored dependency branch so both layers land in one experiment."}}
{"run":14,"commit":"d799910","metric":1,"metrics":{"passing_commands":4,"suite_seconds":1.593},"status":"discard","description":"Combined the two main threads in one experiment: re-vendored and broadly migrated `pinocchio-token-{interface,program}` toward Pinocchio 0.10, then replayed a batch of proven local compressed-token Address/hash/lamports fixes on top. This reduced the remaining `light-compressed-token` errors substantially (down to ~82), but the fast suite still stayed at 1 failure.","timestamp":1775064962929,"segment":0,"confidence":null,"iterationTokens":8378,"asi":{"hypothesis":"Landing both the dependency-root migration and the known local compressed-token fixes in one shot might finally collapse the last failing command or at least produce a much smaller final blocker set.","observations":"The combined pass successfully got the vendored token crates mostly through Pinocchio 0.10 migration and shifted the error surface back to local compressed-token files. Current highest-yield remaining files are `shared/create_pda_account.rs`, `shared/mint_to_token_pool.rs`, `shared/owner_validation.rs`, `shared/initialize_ctoken_account.rs`, plus the remaining unresolved imports/type mismatches elsewhere in compressed-token.","rollback_reason":"Primary metric did not improve; the benchmark still reports one failing command.","next_action_hint":"Continue from the combined branch next time, but drive it with the concrete post-vendor local error list and patch those files first before touching new areas."}}
{"run":15,"commit":"d799910","metric":1,"metrics":{"passing_commands":4,"suite_seconds":1.9},"status":"discard","description":"Re-ran the combined vendored-token approach and pushed the next batch of local compressed-token fixes in the highest-yield helper files (`create_pda_account`, `mint_to_token_pool`, `owner_validation`, `initialize_ctoken_account`) plus more Pinocchio 0.10 cleanup in vendored `p-token`, shrinking the remaining local failure surface to about 85 errors, but the fast suite still remained at 1 failure.","timestamp":1775065324292,"segment":0,"confidence":null,"iterationTokens":13883,"asi":{"hypothesis":"After the combined branch shifted most failures back into local compressed-token helpers, fixing those specific files next should meaningfully reduce the last crate’s error surface and keep the dependency migration path viable.","observations":"The vendored token crates are close enough that the remaining errors are again dominated by local compressed-token files: `lib.rs`, `shared/transfer_lamports.rs`, `shared/validate_ata_derivation.rs`, `shared/token_{input,output}.rs`, and `ctoken/transfer/checked.rs` clone ergonomics. Some replacements missed exact text matches, so those files are still at their pre-migrated state on the reverted branch.","rollback_reason":"Primary metric did not improve; despite shrinking internal compile errors, the benchmark still reports one failing command.","next_action_hint":"Next pass should replay only the exact proven local fixes for `lib.rs`, `transfer_lamports.rs`, `validate_ata_derivation.rs`, `token_input.rs`, `token_output.rs`, and `ctoken/transfer/checked.rs` on top of the vendored dependency branch, using direct file rewrites rather than brittle search/replace."}}
{"run":16,"commit":"d799910","metric":1,"metrics":{"passing_commands":4,"suite_seconds":1.98},"status":"discard","description":"Replayed the exact proven local compressed-token helper fixes (`lib.rs`, `shared/transfer_lamports.rs`, `shared/validate_ata_derivation.rs`, `shared/token_input.rs`, `shared/token_output.rs`, and `ctoken/transfer/checked.rs`) without the vendored dependency migration, but the fast suite still stayed at 1 failure and `light-compressed-token` remained the lone failing command.","timestamp":1775065418532,"segment":0,"confidence":null,"iterationTokens":9174,"asi":{"hypothesis":"Applying only the known-good local Pinocchio 0.10 fixes might be enough to reduce the last crate’s failures further or expose a cleaner root blocker, even without re-vendoring the token dependency.","observations":"This did not help on its own; compile errors actually rose back over 100, which reinforces that the remaining migration is dependency-rooted and the local fixes only pay off on top of the vendored `pinocchio-token-program` path.","rollback_reason":"Primary metric did not improve; local-only fixes are insufficient for the last failing command.","next_action_hint":"Return to the combined vendored-token branch next iteration and stack exact local rewrites on top of it rather than testing local fixes in isolation."}}
{"run":17,"commit":"d799910","metric":1,"metrics":{"passing_commands":4,"suite_seconds":1.81},"status":"discard","description":"Returned to the combined vendored-token path and pushed it further: migrated more of vendored `pinocchio-token-program` plus stacked exact local compressed-token rewrites on top, reducing the remaining `light-compressed-token` error surface to about 69 errors, but the fast suite still remained at 1 failure.","timestamp":1775065636142,"segment":0,"confidence":null,"iterationTokens":14352,"asi":{"hypothesis":"A deeper combined pass across vendored token deps plus exact local rewrites would continue collapsing the last crate’s Pinocchio 0.10 mismatch surface and may be the only viable route to zero migration failures.","observations":"This is the best internal reduction so far: the remaining blockers are now focused in local compressed-token files like `ctoken/close/processor.rs`, `ctoken/create_ata.rs`, `extensions/check_mint_extensions.rs`, and a few lingering `Address`/`[u8; 32]` comparisons in shared and create paths. Dependency migration is no longer the dominant issue once the combined branch is in place.","rollback_reason":"Primary metric did not improve; benchmark still reports one failing command.","next_action_hint":"Next iteration should continue from the combined vendored branch and batch-fix the now-concentrated local Address mismatches in `ctoken/close/processor.rs`, `ctoken/create_ata.rs`, `extensions/check_mint_extensions.rs`, and `shared/initialize_ctoken_account.rs`."}}
{"run":18,"commit":"d799910","metric":1,"metrics":{"passing_commands":4,"suite_seconds":1.671},"status":"discard","description":"Tried another combined vendored-token pass plus targeted local fixes in `ctoken/close/processor.rs`, `ctoken/create_ata.rs`, `extensions/check_mint_extensions.rs`, and `shared/initialize_ctoken_account.rs`, but brittle patching regressed some previously-fixed local files and the fast suite stayed at 1 failure.","timestamp":1775065743520,"segment":0,"confidence":null,"iterationTokens":15906,"asi":{"hypothesis":"Fixing the newly-concentrated local Address mismatch files on top of the vendored dependency branch would continue shrinking the last crate's error surface.","observations":"This approach was directionally right but execution was brittle: automated patching missed exact local rewrites in `lib.rs`, `shared/transfer_lamports.rs`, `shared/validate_ata_derivation.rs`, `shared/token_input.rs`, `shared/token_output.rs`, and `ctoken/transfer/checked.rs`, causing regressions back to older error patterns. The dependency-root hypothesis still stands.","rollback_reason":"Primary metric did not improve and the implementation regressed some already-understood local fixes.","next_action_hint":"Next pass should rebuild the combined branch using exact file rewrites for the known local fixes first, then layer the targeted close/create_ata/check_mint_extensions/init_ctoken fixes on top, avoiding broad search/replace scripts for local files."}}
