{"run":19,"commit":"d799910","metric":1,"metrics":{"passing_commands":4,"suite_seconds":1.463},"status":"discard","description":"Advanced the combined vendored-token + local Pinocchio 0.10 migration substantially: finished the remaining vendored `p-token` blockers, then batch-fixed many `Address`/`[u8;32]` mismatches across compressed-token (`ctoken/{close,create,create_ata}`, transfer2 compression/sum-check paths, compressible claim/withdraw, mint-action helpers, PDA/account conversion helpers). The fast suite still stayed at 1 failure, but `light-compressed-token` compile errors dropped from 73 to 15.","timestamp":1775067240509,"segment":0,"confidence":null,"iterationTokens":15906,"asi":{"hypothesis":"Clearing the last vendored `pinocchio-token-program` issues and then applying another broad local Address/API migration pass would materially shrink the final `light-compressed-token` error surface and maybe finish the last command.","observations":"This was a strong internal reduction: the remaining blockers are now concentrated in a much smaller set of old Pinocchio 0.9 import/API assumptions (`shared/cpi.rs`, `shared/mint_to_token_pool.rs`, `shared/create_pda_account.rs`, `compressible/withdraw_funding_pool.rs`, `ctoken/transfer/shared.rs`) plus a few unsafe `owner()` call sites. Remaining errors are mostly import-path migrations (`instruction::{Seed,Signer}` -> `cpi::{Seed,Signer}`, old `pubkey`/`account_info` modules gone) rather than wide Address conversion fallout.","rollback_reason":"Primary metric did not improve; benchmark remains at one failing command despite large internal progress.","next_action_hint":"Resume from the combined branch again, but target the now-small Pinocchio 0.10 import/API cluster directly: rewrite `shared/cpi.rs` to `InstructionView`/`InstructionAccount` + current CPI types, swap remaining `Seed`/`Signer` imports to `pinocchio::cpi`, replace old `pubkey::*` helpers in `ctoken/transfer/shared.rs`, and wrap the last `owner()` accesses in explicit unsafe blocks or helper accessors."}}
{"run":20,"commit":"d799910","metric":1,"metrics":{"passing_commands":4,"suite_seconds":1.579},"status":"discard","description":"Rebuilt a smaller local Pinocchio 0.10 helper pass on top of the reverted baseline: fixed `Address`/`[u8;32]` conversions in `lib.rs`, owner validation, token input/output hashing, lamport helpers, ATA PDA validation, Token-2022 owner checks, PDA creation helpers, mint-to-token-pool CPI setup, and custom rent-payer detection. The fast suite stayed at 1 failure, but `light-compressed-token` compile errors dropped from 118 to 91.","timestamp":1775067428152,"segment":0,"confidence":null,"iterationTokens":37522,"asi":{"hypothesis":"Reapplying the highest-yield local helper migrations from the earlier combined branch would rapidly cut the compressed-token error surface even before re-vendoring the token dependency.","observations":"This confirms those helper rewrites are still valuable on the clean baseline: error count fell by ~27 without touching the vendored dependency path. The remaining blockers are now dominated by two clusters: (1) direct calls into upstream `pinocchio-token-program` transfer processors still typed against old `pinocchio::account_info::AccountInfo`, and (2) older Pinocchio import/API assumptions in files like `shared/cpi.rs`, `compressible/withdraw_funding_pool.rs`, and `ctoken/transfer/shared.rs`.","rollback_reason":"Primary metric did not improve; benchmark remains at one failing command.","next_action_hint":"Next iteration should combine this local helper batch with the vendored `pinocchio-token-program` path again, or else replace the remaining transfer processor call sites (`ctoken/transfer/{default,checked}.rs`) with locally-migrated logic to break the dependency on old upstream types."}}
